[
  {"name": "m6-eq-itself",      "op": "intervals_equal", "args": {"a": "m6", "b": "m6"}, "expect": {"value": true}},
  {"name": "m6-neq-M3",         "op": "intervals_equal", "args": {"a": "m6", "b": "M3"}, "expect": {"value": false}},
  {"name": "m2-neq-M7",         "op": "intervals_equal", "args": {"a": "m2", "b": "M7"}, "expect": {"value": false}},
  {"name": "P4-neq-P5",         "op": "intervals_equal", "args": {"a": "P4", "b": "P5"}, "expect": {"value": false}},
  {"name": "unison-neq-octave", "op": "intervals_equal", "args": {"a": "Unison", "b": "Octave"}, "expect": {"value": false}},
  {"name": "tritone-eq-itself", "op": "intervals_equal", "args": {"a": "Tritone", "b": "Tritone"}, "expect": {"value": true}},
  {"name": "semitones-Unison",  "op": "interval_semitones", "args": {"x": "Unison"}, "expect": {"value": 0}},
  {"name": "semitones-m2",      "op": "interval_semitones", "args": {"x": "m2"}, "expect": {"value": 1}},
  {"name": "semitones-M2",      "op": "interval_semitones", "args": {"x": "M2"}, "expect": {"value": 2}},
  {"name": "semitones-m3",      "op": "interval_semitones", "args": {"x": "m3"}, "expect": {"value": 3}},
  {"name": "semitones-M3",      "op": "interval_semitones", "args": {"x": "M3"}, "expect": {"value": 4}},
  {"name": "semitones-P4",      "op": "interval_semitones", "args": {"x": "P4"}, "expect": {"value": 5}},
  {"name": "semitones-Tritone", "op": "interval_semitones", "args": {"x": "Tritone"}, "expect": {"value": 6}},
  {"name": "semitones-P5",      "op": "interval_semitones", "args": {"x": "P5"}, "expect": {"value": 7}},
  {"name": "semitones-m6",      "op": "interval_semitones", "args": {"x": "m6"}, "expect": {"value": 8}},
  {"name": "semitones-M6",      "op": "interval_semitones", "args": {"x": "M6"}, "expect": {"value": 9}},
  {"name": "semitones-m7",      "op": "interval_semitones", "args": {"x": "m7"}, "expect": {"value": 10}},
  {"name": "semitones-M7",      "op": "interval_semitones", "args": {"x": "M7"}, "expect": {"value": 11}},
  {"name": "semitones-Octave",  "op": "interval_semitones", "args": {"x": "Octave"}, "expect": {"value": 12}}
]
