[
  {"name": "cs-eq-db", "op": "notes_equal", "args": {"a": "C#", "b": "Db"}, "expect": {"value": true}},
  {"name": "ds-eq-eb", "op": "notes_equal", "args": {"a": "D#", "b": "Eb"}, "expect": {"value": true}},
  {"name": "fs-eq-gb", "op": "notes_equal", "args": {"a": "F#", "b": "Gb"}, "expect": {"value": true}},
  {"name": "gs-eq-ab", "op": "notes_equal", "args": {"a": "G#", "b": "Ab"}, "expect": {"value": true}},
  {"name": "as-eq-bb", "op": "notes_equal", "args": {"a": "A#", "b": "Bb"}, "expect": {"value": true}},
  {"name": "c-neq-d",  "op": "notes_equal", "args": {"a": "C", "b": "D"}, "expect": {"value": false}},
  {"name": "e-neq-f",  "op": "notes_equal", "args": {"a": "E", "b": "F"}, "expect": {"value": false}},
  {"name": "cs-neq-d", "op": "notes_equal", "args": {"a": "C#", "b": "D"}, "expect": {"value": false}},
  {"name": "idx-C",  "op": "note_index", "args": {"n": "C"},  "expect": {"value": 0}},
  {"name": "idx-Cs", "op": "note_index", "args": {"n": "C#"}, "expect": {"value": 1}},
  {"name": "idx-Db", "op": "note_index", "args": {"n": "Db"}, "expect": {"value": 1}},
  {"name": "idx-D",  "op": "note_index", "args": {"n": "D"},  "expect": {"value": 2}},
  {"name": "idx-Ds", "op": "note_index", "args": {"n": "D#"}, "expect": {"value": 3}},
  {"name": "idx-Eb", "op": "note_index", "args": {"n": "Eb"}, "expect": {"value": 3}},
  {"name": "idx-E",  "op": "note_index", "args": {"n": "E"},  "expect": {"value": 4}},
  {"name": "idx-F",  "op": "note_index", "args": {"n": "F"},  "expect": {"value": 5}},
  {"name": "idx-Fs", "op": "note_index", "args": {"n": "F#"}, "expect": {"value": 6}},
  {"name": "idx-Gb", "op": "note_index", "args": {"n": "Gb"}, "expect": {"value": 6}},
  {"name": "idx-G",  "op": "note_index", "args": {"n": "G"},  "expect": {"value": 7}},
  {"name": "idx-Gs", "op": "note_index", "args": {"n": "G#"}, "expect": {"value": 8}},
  {"name": "idx-Ab", "op": "note_index", "args": {"n": "Ab"}, "expect": {"value": 8}},
  {"name": "idx-A",  "op": "note_index", "args": {"n": "A"},  "expect": {"value": 9}},
  {"name": "idx-As", "op": "note_index", "args": {"n": "A#"}, "expect": {"value": 10}},
  {"name": "idx-Bb", "op": "note_index", "args": {"n": "Bb"}, "expect": {"value": 10}},
  {"name": "idx-B",  "op": "note_index", "args": {"n": "B"},  "expect": {"value": 11}}
]
